{
  "format": "bonsai.packs/1",
  "command": "outdated",
  "packs": [
    {
      "id": "base",
      "source": "https://github.com/LastStep/Bonsai.git",
      "path": "packs/base",
      "ref": "base-v1.0.0",
      "commit": "0a1b2c3d4e5f60718293a4b5c6d7e8f901a2b3c4",
      "version": "1.0.0",
      "needs": null,
      "skills": [
        "memory",
        "run",
        "task"
      ],
      "roles": [],
      "deny": [
        "Read(./.env)"
      ],
      "protected": [
        "bonsai.yaml"
      ],
      "kinds": [],
      "newer": {
        "tag": "base-v1.0.1",
        "read": "2026-10-29T08:15:00Z",
        "state": "newer"
      },
      "why": null
    },
    {
      "id": "workflow",
      "source": "https://github.com/LastStep/bonsai-workflow.git",
      "path": null,
      "ref": "v1.0.1",
      "commit": "1b2c3d4e5f60718293a4b5c6d7e8f901a2b3c4d5",
      "version": "1.0.1",
      "needs": {
        "claude_code": "2.1.300"
      },
      "skills": null,
      "roles": [
        "builder",
        "verifier"
      ],
      "deny": [],
      "protected": [],
      "kinds": [
        "plan",
        "feature"
      ],
      "newer": null,
      "why": "git ls-remote failed: could not resolve host"
    }
  ],
  "error": null
}
